Issue,Possible Cause,Solution
Example 1,"Lorem ipsum dolor sit amet, consectetuer adipiscing elit.",Maecenas porttitor congue massa.
Example 2,"Fusce posuere, magna sed pulvinar ultricies, purus lectus malesuada libero, sit amet commodo magna eros quis urna.",Nunc viverra imperdiet enim.
Example 3,Fusce est.,Vivamus a tellus.
Example 4,Pellentesque habitant morbi tristique senectus et netus et malesuada fames ac turpis egestas.,Proin pharetra nonummy pede.
Exmaple 5,Donec laoreet nonummy augue.,"Suspendisse dui purus, scelerisque at, vulputate vitae, pretium mattis, nunc." 